{
  "$schema": "https://kaesual.github.io/arena-web/schemas/artifact-manifest.schema.json",
  "artifacts": [
    {
      "path": "baseq3/vm/cgame.qvm",
      "sha256": "12d597a49bc351149d7459692a0311cc5e186cf4f376c703ddaa6cfa27a602e4",
      "size": 343304
    },
    {
      "path": "baseq3/vm/qagame.qvm",
      "sha256": "449fbd197d34ec3f51006438fc2bf961cdabdf38101b6a17d33f107ad4186805",
      "size": 488108
    },
    {
      "path": "baseq3/vm/ui.qvm",
      "sha256": "23ba9181726e108be05a0096a9f49f3c7643d4ff8888267a6948c4a4e8389c33",
      "size": 307164
    },
    {
      "path": "ioquake3-config.json",
      "sha256": "d75941dc65e1c0006ac8ac5925af3291a4c1e7b6975a295e0f5cf86a7ee2aa66",
      "size": 2201
    },
    {
      "path": "ioquake3.html",
      "sha256": "a43ca343372f7f8683d46d137f3ebbfbd8f5879d71a84fbbd6a3ff907082bcb2",
      "size": 3995
    },
    {
      "path": "ioquake3.js",
      "sha256": "a180b0ddc60608841f60c73426419fa79ecb1c3d5bf9c47a436b899ef011756e",
      "size": 266885
    },
    {
      "path": "ioquake3.wasm",
      "sha256": "897962a7eccc1785f7c7dd186a7189fa979074ebce03dc093f1138d233b89059",
      "size": 2319487
    },
    {
      "path": "missionpack/vm/cgame.qvm",
      "sha256": "a9963c8a60dd3a4a4ec9e278ef6b00fa40b4ab663e980f90baa48bdccf469949",
      "size": 519920
    },
    {
      "path": "missionpack/vm/qagame.qvm",
      "sha256": "cd615ce97dd65b2879158b540f0d331eb27fb52be9af7c8350dcc403955e3f68",
      "size": 575916
    },
    {
      "path": "missionpack/vm/ui.qvm",
      "sha256": "80783e0cfe98e5ea0009863c02c56b3c022a7c74468b5218c4870ce178accec5",
      "size": 306680
    }
  ],
  "baselineIdentity": "sha256:cc45026e109df38a3b019192ed8b6807bae8bc787119b2b89fe5c7a6f28c05f1",
  "baselineInputIds": [
    "emscripten-builder",
    "ioq3"
  ],
  "digestAlgorithm": "sha256",
  "formatVersion": 1,
  "inputs": [
    {
      "id": "emscripten-builder",
      "identity": "docker.io/emscripten/emsdk@sha256:8714ed3a9fb585e662c931259a996bac36a57a8dd34b81e8277436fd77364475",
      "kind": "oci-image"
    },
    {
      "id": "emscripten-port-sdl2",
      "identity": "sha256:7a3c207b8509edc487d658df357ad764cd852d68fe248d307b25c0741d52fdf0",
      "kind": "archive"
    },
    {
      "id": "ioq3",
      "identity": "git:596e56a6bf58f41e1ad9cc1685c7c11a75dba87a",
      "kind": "git"
    }
  ],
  "producer": {
    "commit": "ecd96c985280a06da759dac72afbc1ef506a25bc",
    "name": "arena-web scripts/build-browser.sh"
  }
}
