{
  "$schema": "https://kaesual.github.io/arena-web/schemas/artifact-manifest.schema.json",
  "artifacts": [
    {
      "path": "baseq3/arena-web-ffa-base.pk3",
      "sha256": "6c3341ef87d16c75b7d3fb5f368d9f935dac304c1dd7667f96b64dd73912bb03",
      "size": 40913889
    },
    {
      "path": "baseq3/arena-web-ffa-map-oa_pvomit.pk3",
      "sha256": "304a2266a08ebe2f3b63117214dd9cf2489b974c2036d6cf05309555e3ce95d3",
      "size": 1923375
    }
  ],
  "baselineIdentity": "sha256:227c9434ba306b5b95bb36f392b1d9faa08fdef5b325dd4d557d8c4b8ee55287",
  "baselineInputIds": [
    "ioq3"
  ],
  "digestAlgorithm": "sha256",
  "formatVersion": 1,
  "inputs": [
    {
      "id": "arena-web",
      "identity": "sha256:09c154c2bbe580f4be6862bc66509886b8fb6f7a1bce4483f186ff095ecd0e68",
      "kind": "archive"
    },
    {
      "id": "arena-web-map-oa_pvomit",
      "identity": "sha256:2aee900f193f2fcc0e9dd4c4ff1fd5d04dc3111769cee139f96187e634ef4f91",
      "kind": "archive"
    },
    {
      "id": "ioq3",
      "identity": "git:d594b1cc9bfc5b58ccebffd4d840a13782cb6592",
      "kind": "git"
    },
    {
      "id": "openarena-088-data",
      "identity": "sha256:66db4a12ed575f4fee8eb2171acdd925c105e3b49570a12baf99968d13d302f0",
      "kind": "archive"
    },
    {
      "id": "openarena-data",
      "identity": "sha256:66c7bcf44022ce96331c15718e7145d5367aa23bff95e2fce7abfc844ae6e588",
      "kind": "archive"
    },
    {
      "id": "openarena-maps",
      "identity": "sha256:f9922a8e080e5f1de3e190deb355f50f8ca1700dcbe28aab88be07e6a45dea60",
      "kind": "archive"
    },
    {
      "id": "openarena-misc",
      "identity": "sha256:ba65afb212c6909e974b32d9f0b2696e33c579bf63e44e1d9320c7b183f00c6c",
      "kind": "archive"
    },
    {
      "id": "openarena-players",
      "identity": "sha256:7e443d7171414ae97514209e2512388d616dafbaadfdcf63204821491ffcb5c6",
      "kind": "archive"
    },
    {
      "id": "openarena-textures",
      "identity": "sha256:40229bb6852675e29684817af80b66a839c89b7062043ff3df5f3f420846bb0a",
      "kind": "archive"
    }
  ],
  "producer": {
    "commit": "95f45b537dd0bb8b4a542b97d0f4281eefa7604a",
    "name": "arena-web scripts/build-content-pack.sh"
  }
}
